{
  "base": {
    "commit": "af48f06be20a1926a24d0bba6ce339e754c5735f",
    "tree": "f1aa04cdc600e3c52fcdc3400ce159be35a4d792"
  },
  "cleanAfterPreparation": true,
  "lockfiles": [
    {
      "path": "apps/react-vite/yarn.lock",
      "sha256": "24f3d961ee08c108d356f3e3efff0deedf55aa3579a7096f8ec94c9b38049364"
    }
  ],
  "partition": "development",
  "preparation": [
    {
      "args": [
        "--",
        ".env.example",
        ".env"
      ],
      "cwd": "apps/react-vite",
      "executable": "/bin/cp",
      "id": "copy-project-environment",
      "network": "none",
      "required": true,
      "timeoutMs": 10000
    },
    {
      "args": [
        "install",
        "--frozen-lockfile"
      ],
      "cwd": "apps/react-vite",
      "executable": "yarn",
      "id": "install-dependencies",
      "network": "dependency-registry",
      "required": true,
      "timeoutMs": 7200000
    },
    {
      "args": [
        "-c",
        "safe.directory=/work/source",
        "restore",
        "--source=HEAD",
        "--",
        "apps/react-vite/public/mockServiceWorker.js"
      ],
      "cwd": ".",
      "executable": "/usr/bin/git",
      "id": "restore-generated-service-worker",
      "network": "none",
      "required": true,
      "timeoutMs": 10000
    }
  ],
  "profile": {
    "arch": "x64",
    "bunVersion": null,
    "id": "node-20.16.0-yarn-1.22.22",
    "nodeVersion": "20.16.0",
    "os": "linux",
    "packageManager": {
      "name": "yarn",
      "version": "1.22.22"
    }
  },
  "projectPath": "apps/react-vite",
  "review": {
    "notes": "Independent re-review found that proxy-isolated Yarn installation removes the tracked MSW worker at this frozen base. Preparation now restores only apps/react-vite/public/mockServiceWorker.js from each role's own HEAD after installation, preserving source fidelity without ignoring or broadly cleaning any other mutation. Approved by the sole maintainer after independent review of the frozen source, lockfile, runtime, and preparation contract and successful exact GitHub-hosted Linux x64 probe run 30636316819, attempt 1. Offline retained GitHub OIDC provenance re-verification bound source commit d1454e0d1927bdc13a1393c8a4e603f1c74ef277, subject 28d00ea623b6a69d713ae440389f90db8ea9f3d6edb89e1d26219a164e216d4c, immutable image ghcr.io/decantr-ai/decantr-benchmark-3-10@sha256:5b599f1773b75fddab773eb09b97cd955d9b6bee3d327f4628509495d53e588b, zero failed required commands, and a clean worktree before and after preparation.",
    "reviewedAt": "2026-07-31T17:57:54Z",
    "reviewedBy": "David Aimi (sole maintainer), execution assisted by OpenAI Codex",
    "status": "approved"
  },
  "schemaVersion": "decantr-benchmark-task-environment.v1",
  "sourceEvidence": [
    {
      "kind": "reviewer-override",
      "path": ".github/workflows/ci.yml",
      "sha256": "71b9294ed6cbdd51cffb35e2ffc58b7f6ae2780c747c45e99348c39b229c2cb0",
      "statement": "Frozen CI selects the Node LTS line, uses the project directory, copies its environment file, and installs with Yarn."
    },
    {
      "kind": "package-manifest",
      "path": "apps/react-vite/package.json",
      "sha256": "cc52ee4cf6c90c281ec152268573846efe150e5e170224b463aec28e6591d886",
      "statement": "Manifest evidence considered for yarn and runtime selection."
    },
    {
      "kind": "lockfile",
      "path": "apps/react-vite/yarn.lock",
      "sha256": "24f3d961ee08c108d356f3e3efff0deedf55aa3579a7096f8ec94c9b38049364",
      "statement": "Selected yarn lockfile for deterministic dependency preparation."
    }
  ],
  "taskId": "bulletproof-react-vite.discussion-pagination"
}
